<?xml version="1.0" encoding="UTF-8"?>




<!--<LOGGING xmlns:xsi="http://www.w3.org/2001/XMLSchema-instance"
    xsi:noNamespaceSchemaLocation="logging.xsd">
</LOGGING>-->



<LOGGING xmlns:xsi="http://www.w3.org/2001/XMLSchema-instance"
    xsi:noNamespaceSchemaLocation="logging.xsd">


<!-- Stepper motors -->
    <MOTOR_STEPPER>
        <DEVICE_ADDRESS>
            <DEVICE_ID>M2</DEVICE_ID>
            <DEVICE_NAME>Open/close motor starboard</DEVICE_NAME>
            <IP_ADDRESS>192.168.1.12</IP_ADDRESS>
            <CARD>
                <MANUFACTURER_ID>X-NUCLEO-IHM03A1</MANUFACTURER_ID>
                <CARD_NAME>Stepper motor driver 10 A</CARD_NAME>
                <CARD_ID>2</CARD_ID>
                <DEVICE_PORT_NO>1</DEVICE_PORT_NO>
            </CARD>
        </DEVICE_ADDRESS>
        <DEVICE_TYPE>MotorStepper</DEVICE_TYPE>
        <STEP_UNIT_CONVERSION>
            <UNIT>angle_deg</UNIT>
            <UNIT_PER_STEP>0.000078</UNIT_PER_STEP>
        </STEP_UNIT_CONVERSION>
        <MOTOR_CONFIG>
            <DIRECTION_POSITIVE>CW</DIRECTION_POSITIVE>
            <ENDSTOP_SOFT_POSITIVE></ENDSTOP_SOFT_POSITIVE>
            <ENDSTOP_SOFT_NEGATIVE></ENDSTOP_SOFT_NEGATIVE>
            <MAX_SPEED>1</MAX_SPEED>
            <SPEED>0.06</SPEED>
            <MAX_ACCELERATION>0.01</MAX_ACCELERATION>
            <ACCELERATION>0.01</ACCELERATION>
            <MAX_CURRENT>10</MAX_CURRENT>
            <CURRENT>9</CURRENT>
            <INACTIVE_TIMEOUT>100</INACTIVE_TIMEOUT>
            <INACTIVE_CURRENT>0.1</INACTIVE_CURRENT>
            <HOME_DEVICE_ID></HOME_DEVICE_ID>
            <HOME_VALUE>0</HOME_VALUE>
            <HOME_DIRECTION></HOME_DIRECTION>
            <ENDSTOP_DEVICE_ID_POSITIVE></ENDSTOP_DEVICE_ID_POSITIVE>
            <ENDSTOP_DEVICE_ID_NEGATIVE></ENDSTOP_DEVICE_ID_NEGATIVE>
        </MOTOR_CONFIG>
    </MOTOR_STEPPER>



<!-- Virtual motors -->


    <MOTOR_VIRTUAL_XY>
        <IP_ADDRESS>192.168.1.16</IP_ADDRESS>
        <DEVICE_ID>XY2</DEVICE_ID>
        <DEVICE_TYPE>MotorVirtualXY</DEVICE_TYPE>
        <DEVICE_NAME>C360 c-ring control</DEVICE_NAME>
        <MOTOR_TRANSLATION>M7</MOTOR_TRANSLATION>
        <MOTOR_ROTATION>M8</MOTOR_ROTATION>
    </MOTOR_VIRTUAL_XY>

    <MOTOR_VIRTUAL_XY>
        <IP_ADDRESS>192.168.1.15</IP_ADDRESS>
        <DEVICE_ID>XY1</DEVICE_ID>
        <DEVICE_TYPE>MotorVirtualXY</DEVICE_TYPE>
        <DEVICE_NAME>C180 c-ring control</DEVICE_NAME>
        <MOTOR_TRANSLATION>M5</MOTOR_TRANSLATION>
        <MOTOR_ROTATION>M6</MOTOR_ROTATION>
    </MOTOR_VIRTUAL_XY> 

<!-- Analog external sensors -->


    <SENSOR_ANALOG_DIRECT>
        <DEVICE_ADDRESS>
            <DEVICE_ID>S1</DEVICE_ID>
            <DEVICE_NAME>Flow line temperature</DEVICE_NAME>
            <IP_ADDRESS>192.168.1.12</IP_ADDRESS>
            <CARD>
                <MANUFACTURER_ID>POWER-IO-01</MANUFACTURER_ID>
                <CARD_NAME>PowerIO</CARD_NAME>
                <CARD_ID>4</CARD_ID>
                <DEVICE_PORT_NO>20</DEVICE_PORT_NO>
            </CARD>
        </DEVICE_ADDRESS>
        <DEVICE_TYPE>SensorAnalogDirect</DEVICE_TYPE>
        <UNIT_CONVERSION>
            <INPUT_TYPE>0-10V</INPUT_TYPE>
            <!-- <OUTPUT_UNIT>V</OUTPUT_UNIT> -->
            <MIN_INPUT>0</MIN_INPUT>
            <MAX_INPUT>10</MAX_INPUT>
            <MIN_OUTPUT>-40</MIN_OUTPUT>
            <MAX_OUTPUT>85</MAX_OUTPUT>
        </UNIT_CONVERSION>
        <THRESHOLDS>
            <ALARM_LOW></ALARM_LOW>
            <WARNING_LOW></WARNING_LOW>
            <WARNING_HIGH></WARNING_HIGH>
            <ALARM_HIGH></ALARM_HIGH>
        </THRESHOLDS>
        <DEVICE_ID_AUX>???</DEVICE_ID_AUX>
    </SENSOR_ANALOG_DIRECT>

    <SENSOR_ANALOG_DIRECT>
        <DEVICE_ADDRESS>
            <DEVICE_ID>S2</DEVICE_ID>
            <DEVICE_NAME>Habitat external temperature</DEVICE_NAME>
            <IP_ADDRESS>192.168.1.13</IP_ADDRESS>
            <CARD>
                <MANUFACTURER_ID>POWER-IO-01</MANUFACTURER_ID>
                <CARD_NAME>PowerIO</CARD_NAME>
                <CARD_ID>4</CARD_ID>
                <DEVICE_PORT_NO>20</DEVICE_PORT_NO>
            </CARD>
        </DEVICE_ADDRESS>
        <DEVICE_TYPE>SensorAnalogDirect</DEVICE_TYPE>
        <UNIT_CONVERSION>
            <INPUT_TYPE>4-20mA</INPUT_TYPE>
            <!-- <OUTPUT_UNIT>Â°C</OUTPUT_UNIT> -->
            <MIN_INPUT>4</MIN_INPUT>
            <MAX_INPUT>20</MAX_INPUT>
            <MIN_OUTPUT>-3.9</MIN_OUTPUT>
            <MAX_OUTPUT>79.4</MAX_OUTPUT>
        </UNIT_CONVERSION>
        <THRESHOLDS>
            <ALARM_LOW></ALARM_LOW>
            <WARNING_LOW></WARNING_LOW>
            <WARNING_HIGH></WARNING_HIGH>
            <ALARM_HIGH></ALARM_HIGH>
        </THRESHOLDS>
        <DEVICE_ID_AUX>???</DEVICE_ID_AUX>
    </SENSOR_ANALOG_DIRECT>

  

    <SENSOR_BOOL_DIRECT>
        <DEVICE_ADDRESS>
            <DEVICE_ID>S6</DEVICE_ID>
            <DEVICE_NAME>C180 translational end stop</DEVICE_NAME>
            <IP_ADDRESS>192.168.1.15</IP_ADDRESS>
            <CARD>
                <MANUFACTURER_ID>POWER-IO-01</MANUFACTURER_ID>
                <CARD_NAME>PowerIO</CARD_NAME>
                <CARD_ID>4</CARD_ID>
                <DEVICE_PORT_NO>20</DEVICE_PORT_NO>
            </CARD>
        </DEVICE_ADDRESS>
        <DEVICE_TYPE>SensorBoolDirect</DEVICE_TYPE>
        <INPUT_TYPE>PNP</INPUT_TYPE>
        <ACTIVE_HIGH>true</ACTIVE_HIGH>
        <ALARM>false</ALARM>
        <DEVICE_ID_AUX>???</DEVICE_ID_AUX>
    </SENSOR_BOOL_DIRECT>

    <SENSOR_BOOL_DIRECT>
        <DEVICE_ADDRESS>
            <DEVICE_ID>S7</DEVICE_ID>
            <DEVICE_NAME>C180 rotational home</DEVICE_NAME>
            <IP_ADDRESS>192.168.1.15</IP_ADDRESS>
            <CARD>
                <MANUFACTURER_ID>POWER-IO-01</MANUFACTURER_ID>
                <CARD_NAME>PowerIO</CARD_NAME>
                <CARD_ID>4</CARD_ID>
                <DEVICE_PORT_NO>21</DEVICE_PORT_NO>
            </CARD>
        </DEVICE_ADDRESS>
        <DEVICE_TYPE>SensorBoolDirect</DEVICE_TYPE>
        <INPUT_TYPE>PNP</INPUT_TYPE>
        <ACTIVE_HIGH>true</ACTIVE_HIGH>
        <ALARM>false</ALARM>
        <DEVICE_ID_AUX>???</DEVICE_ID_AUX>
    </SENSOR_BOOL_DIRECT>

  

<!-- Local sensors in each unit -->


 
    <SENSOR_LOCAL>
        <DEVICE_ADDRESS>
            <DEVICE_ID>L1-U1-S2</DEVICE_ID>
            <DEVICE_NAME>SEM 1 current consumption</DEVICE_NAME>
            <IP_ADDRESS>192.168.1.11</IP_ADDRESS>
            <CARD>
                <MANUFACTURER_ID>POWER-IO-01</MANUFACTURER_ID>
                <CARD_NAME>PowerIO</CARD_NAME>
                <CARD_ID>4</CARD_ID>
                <DEVICE_PORT_NO>31</DEVICE_PORT_NO>
            </CARD>
        </DEVICE_ADDRESS>
        <DEVICE_TYPE>SensorLocal</DEVICE_TYPE>
        <UNIT_CONVERSION>
            <INPUT_TYPE>0-10V</INPUT_TYPE>
            <!-- <OUTPUT_UNIT></OUTPUT_UNIT> -->
            <MIN_INPUT>405.3</MIN_INPUT>
            <MAX_INPUT>4096</MAX_INPUT>
            <MIN_OUTPUT>0</MIN_OUTPUT> 
            <MAX_OUTPUT>45.53</MAX_OUTPUT>
        </UNIT_CONVERSION>
        <THRESHOLDS>
            <ALARM_LOW></ALARM_LOW>
            <WARNING_LOW></WARNING_LOW>
            <WARNING_HIGH></WARNING_HIGH>
            <ALARM_HIGH></ALARM_HIGH>
        </THRESHOLDS>
        <DEVICE_ID_AUX>???</DEVICE_ID_AUX>
    </SENSOR_LOCAL>

  


    <SENSOR_LOCAL>
        <DEVICE_ADDRESS>
            <DEVICE_ID>L7-U1-S4</DEVICE_ID>
            <DEVICE_NAME>SEM 7 humidity</DEVICE_NAME>
            <IP_ADDRESS>192.168.1.17</IP_ADDRESS>
            <CARD>
                <MANUFACTURER_ID>POWER-IO-01</MANUFACTURER_ID>
                <CARD_NAME>PowerIO</CARD_NAME>
                <CARD_ID>4</CARD_ID>
                <DEVICE_PORT_NO>32</DEVICE_PORT_NO>
            </CARD>
        </DEVICE_ADDRESS>
        <DEVICE_TYPE>SensorLocal</DEVICE_TYPE>
        <UNIT_CONVERSION>
            <INPUT_TYPE>SPI</INPUT_TYPE>
            <!-- <OUTPUT_UNIT>%</OUTPUT_UNIT> -->
            <MIN_INPUT></MIN_INPUT>
            <MAX_INPUT></MAX_INPUT>
            <MIN_OUTPUT></MIN_OUTPUT> 
            <MAX_OUTPUT></MAX_OUTPUT>
        </UNIT_CONVERSION>
        <THRESHOLDS>
            <ALARM_LOW></ALARM_LOW>
            <WARNING_LOW></WARNING_LOW>
            <WARNING_HIGH></WARNING_HIGH>
            <ALARM_HIGH></ALARM_HIGH>
        </THRESHOLDS>
        <DEVICE_ID_AUX>???</DEVICE_ID_AUX>
    </SENSOR_LOCAL>

 

<!-- Solenoids -->


    <SOLENOID>
        <DEVICE_ADDRESS>
            <DEVICE_ID>V1</DEVICE_ID>
            <DEVICE_NAME>Habitat drain valve</DEVICE_NAME>
            <IP_ADDRESS>192.168.1.11</IP_ADDRESS>
            <CARD>
                <MANUFACTURER_ID>POWER-IO-01</MANUFACTURER_ID>
                <CARD_NAME>PowerIO</CARD_NAME>
                <CARD_ID>4</CARD_ID>
                <DEVICE_PORT_NO>37</DEVICE_PORT_NO>
            </CARD>
        </DEVICE_ADDRESS>
        <DEVICE_TYPE>Solenoid</DEVICE_TYPE>
        <MAX_CURRENT>2</MAX_CURRENT>
        <ACTIVATE_CURRENT>2</ACTIVATE_CURRENT>
        <HOLD_CURRENT>1</HOLD_CURRENT>
    </SOLENOID>

    <SOLENOID>
        <DEVICE_ADDRESS>
            <DEVICE_ID>V4</DEVICE_ID>
            <DEVICE_NAME>Air pressure valve</DEVICE_NAME>
            <IP_ADDRESS>192.168.1.13</IP_ADDRESS>
            <CARD>
                <MANUFACTURER_ID>POWER-IO-01</MANUFACTURER_ID>
                <CARD_NAME>PowerIO</CARD_NAME>
                <CARD_ID>4</CARD_ID>
                <DEVICE_PORT_NO>39</DEVICE_PORT_NO>
            </CARD>
        </DEVICE_ADDRESS>
        <DEVICE_TYPE>Solenoid</DEVICE_TYPE>
        <MAX_CURRENT>2</MAX_CURRENT>
        <ACTIVATE_CURRENT>2</ACTIVATE_CURRENT>
        <HOLD_CURRENT>1</HOLD_CURRENT>
    </SOLENOID>


<!-- PWM signals -->



    <PWM_SIGNAL>
        <DEVICE_ADDRESS>
            <DEVICE_ID>L2</DEVICE_ID>
            <DEVICE_NAME>LED lights inside habitat</DEVICE_NAME>
            <IP_ADDRESS>192.168.1.14</IP_ADDRESS>
            <CARD>
                <MANUFACTURER_ID>POWER-IO-01</MANUFACTURER_ID>